{
  "schemaVersion": "2.1.0",
  "id": "formula-mana-summoner",
  "version": "1.0.0",
  "rulesetId": "mu-s4-global-reference",
  "status": "PUBLISHED",
  "confidence": "VERIFIED",
  "purpose": "Calculate visible base Mana for the Summoner family before equipment, options, buffs, private profiles, or undeclared modifiers.",
  "applicability": {
    "characterClassId": "class-summoner",
    "evolutionIds": [
      "evolution-summoner",
      "evolution-bloody-summoner",
      "evolution-dimension-master"
    ]
  },
  "inputs": [
    {
      "id": "character-level",
      "numericType": "INT32",
      "unit": "level",
      "numericBounds": {
        "minimum": 1,
        "minimumInclusive": true,
        "maximum": 2147483647,
        "maximumInclusive": true,
        "classification": "TECHNICAL"
      },
      "rangeErrorCode": "formula-level-out-of-range",
      "source": {
        "kind": "CONTEXT_VALUE",
        "valueId": "character-level"
      }
    },
    {
      "id": "energy",
      "numericType": "INT64",
      "unit": "stat-point",
      "numericBounds": {
        "minimum": 23,
        "minimumInclusive": true,
        "classification": "FACTUAL",
        "evidenceRefs": ["evd-0021"]
      },
      "rangeErrorCode": "formula-stat-below-base",
      "source": {
        "kind": "CONTEXT_VALUE",
        "valueId": "resolved-energy"
      }
    }
  ],
  "output": {
    "id": "mana",
    "numericType": "INT64",
    "unit": "mana-point"
  },
  "strategy": {
    "kind": "PROGRAM",
    "executionModel": "CHECKED_DECIMAL_V1",
    "steps": [
      {
        "id": "base",
        "operation": "CONSTANT",
        "operands": [{ "kind": "LITERAL", "value": 40 }]
      },
      {
        "id": "level-offset",
        "operation": "SUBTRACT",
        "operands": [
          { "kind": "INPUT", "inputId": "character-level" },
          { "kind": "LITERAL", "value": 1 }
        ]
      },
      {
        "id": "level-contribution",
        "operation": "MULTIPLY",
        "operands": [
          { "kind": "STEP", "stepId": "level-offset" },
          { "kind": "LITERAL", "value": 1.5 }
        ]
      },
      {
        "id": "energy-offset",
        "operation": "SUBTRACT",
        "operands": [
          { "kind": "INPUT", "inputId": "energy" },
          { "kind": "LITERAL", "value": 23 }
        ]
      },
      {
        "id": "energy-contribution",
        "operation": "MULTIPLY",
        "operands": [
          { "kind": "STEP", "stepId": "energy-offset" },
          { "kind": "LITERAL", "value": 1.7 }
        ]
      },
      {
        "id": "raw-mana",
        "operation": "ADD",
        "operands": [
          { "kind": "STEP", "stepId": "base" },
          { "kind": "STEP", "stepId": "level-contribution" },
          { "kind": "STEP", "stepId": "energy-contribution" }
        ]
      },
      {
        "id": "visible-mana",
        "operation": "APPLY_ROUNDING",
        "operands": [{ "kind": "STEP", "stepId": "raw-mana" }]
      }
    ],
    "dependencyFormulaRefs": []
  },
  "rounding": {
    "mode": "TRUNCATE",
    "stage": "visible-mana",
    "decimalPlaces": 0
  },
  "trace": {
    "stepIds": [
      "base",
      "level-offset",
      "level-contribution",
      "energy-offset",
      "energy-contribution",
      "raw-mana",
      "visible-mana"
    ],
    "rawOutputStepId": "raw-mana",
    "visibleOutputStepId": "visible-mana"
  },
  "constraints": [
    "Resolve class and evolution applicability before evaluating arithmetic.",
    "Represent 1.5 and 1.7 exactly as base-10 decimals and use checked decimal arithmetic.",
    "Do not round the level contribution, energy contribution, or raw-mana before visible-mana.",
    "Truncate raw-mana toward zero exactly once at visible-mana."
  ],
  "evidenceRefs": [
    "evd-0021",
    "evd-0026",
    "evd-0027",
    "evd-0028",
    "evd-0029",
    "evd-0031"
  ],
  "conflictIds": [],
  "testCaseRefs": [
    { "id": "mana-summoner-base", "version": "1.0.0" },
    { "id": "mana-summoner-level-step", "version": "1.0.0" },
    { "id": "mana-summoner-energy-step", "version": "1.0.0" },
    { "id": "mana-summoner-combined-step", "version": "1.0.0" }
  ]
}
