{
  "schemaVersion": "2.1.0",
  "id": "formula-pvp-attack-rate-fairy-elf",
  "version": "1.0.0",
  "rulesetId": "mu-s4-global-reference",
  "status": "PUBLISHED",
  "confidence": "VERIFIED",
  "purpose": "Calculate visible base PVP attack rate for the Fairy Elf family before equipment, options, buffs, private profiles, or undeclared modifiers.",
  "applicability": {
    "characterClassId": "class-fairy-elf",
    "evolutionIds": ["evolution-fairy-elf", "evolution-muse-elf", "evolution-high-elf"]
  },
  "inputs": [
    {
      "id": "character-level",
      "numericType": "INT32",
      "unit": "level",
      "numericBounds": {
        "minimum": 1,
        "minimumInclusive": true,
        "maximum": 2147483647,
        "maximumInclusive": true,
        "classification": "TECHNICAL"
      },
      "rangeErrorCode": "formula-level-out-of-range",
      "source": { "kind": "CONTEXT_VALUE", "valueId": "character-level" }
    },
    {
      "id": "agility",
      "numericType": "INT64",
      "unit": "stat-point",
      "numericBounds": {
        "minimum": 25,
        "minimumInclusive": true,
        "classification": "FACTUAL",
        "evidenceRefs": ["evd-0021"]
      },
      "rangeErrorCode": "formula-stat-below-base",
      "source": { "kind": "CONTEXT_VALUE", "valueId": "resolved-agility" }
    }
  ],
  "output": { "id": "pvp-attack-rate", "numericType": "INT64", "unit": "rate-point" },
  "strategy": {
    "kind": "PROGRAM",
    "executionModel": "CHECKED_DECIMAL_V1",
    "steps": [
      {
        "id": "level-contribution",
        "operation": "MULTIPLY",
        "operands": [
          { "kind": "INPUT", "inputId": "character-level" },
          { "kind": "LITERAL", "value": 3 }
        ]
      },
      {
        "id": "agility-contribution",
        "operation": "MULTIPLY",
        "operands": [
          { "kind": "INPUT", "inputId": "agility" },
          { "kind": "LITERAL", "value": 0.6 }
        ]
      },
      {
        "id": "raw-pvp-attack-rate",
        "operation": "ADD",
        "operands": [
          { "kind": "STEP", "stepId": "level-contribution" },
          { "kind": "STEP", "stepId": "agility-contribution" }
        ]
      },
      {
        "id": "visible-pvp-attack-rate",
        "operation": "APPLY_ROUNDING",
        "operands": [
          { "kind": "STEP", "stepId": "raw-pvp-attack-rate" }
        ]
      }
    ],
    "dependencyFormulaRefs": []
  },
  "rounding": { "mode": "TRUNCATE", "stage": "visible-pvp-attack-rate", "decimalPlaces": 0 },
  "trace": {
    "stepIds": ["level-contribution", "agility-contribution", "raw-pvp-attack-rate", "visible-pvp-attack-rate"],
    "rawOutputStepId": "raw-pvp-attack-rate",
    "visibleOutputStepId": "visible-pvp-attack-rate"
  },
  "constraints": [
    "Resolve class and evolution applicability before evaluating arithmetic.",
    "Represent the exact literals 3 and 0.6 as base-10 decimals and use checked decimal arithmetic.",
    "Do not round any step before visible-pvp-attack-rate.",
    "Truncate raw-pvp-attack-rate toward zero exactly once at visible-pvp-attack-rate."
  ],
  "evidenceRefs": ["evd-0021", "evd-0026"],
  "conflictIds": [],
  "testCaseRefs": [
    { "id": "pvp-attack-rate-fairy-elf-base", "version": "1.0.0" },
    { "id": "pvp-attack-rate-fairy-elf-fraction-step", "version": "1.0.0" },
    { "id": "pvp-attack-rate-fairy-elf-integer-step", "version": "1.0.0" },
    { "id": "pvp-attack-rate-fairy-elf-high-elf-step", "version": "1.0.0" }
  ]
}
